URL,Price,State,District,City,Type,Bedrooms,Bathrooms,Furnishing,Status,Listed by,Builtup Area,Carpet Area,Total Floors,Floor No,Car Parking,Maintenance,Facing,Project Name,Description,AD ID
https://www.olx.in/item/2-bhk-for-sale-in-ashiana-tarang-iid-1509634743," 32,00,000",Rajasthan,Bhiwadi,Khanpur,Apartments,2,2,Semi-Furnished,Ready to Move,Builder,1118,900,14,11,1,0,North-East,Ashiana Tarang,1.  Lift(s)  2.  24/7 Water Supply  3.  24/7 Power Backup  4.  Fire Fighting Systems  5.  InterCom  6.  Car Parking  7.  Gymnasium  8. Club House  9.  Children's Play Area  Project Advantage:  - High speed lifts & latest fire fighting equipments.  - Professional Maintenance.  - 24 Hour Security and gated complex.  - Convenience Store.  - Swimming pool & kids pool.  - Plumber and electrician on call.,1509634743
https://www.olx.in/item/2-bhk-for-sale-in-ashiana-tarang-iid-1509634515," 32,00,000",Rajasthan,Bhiwadi,Mundana Meo,Apartments,2,2,Semi-Furnished,Ready to Move,Builder,1118,900,14,10,1,0,North-East,Ashiana Tarang,1.  Lift(s)  2.  24/7 Water Supply  3.  24/7 Power Backup  4.  Fire Fighting Systems  5.  InterCom  6.  Car Parking  7.  Gymnasium  8. Club House  9.  Children's Play Area  Project Advantage:  - High speed lifts & latest fire fighting equipments.  - Professional Maintenance.  - 24 Hour Security and gated complex.  - Convenience Store.  - Swimming pool & kids pool.  - Plumber and electrician on call.,1509634515
https://www.olx.in/item/2-bhk-for-sale-in-ashiana-tarang-iid-1509629247," 32,00,000",Rajasthan,Bhiwadi,Santhalka,Apartments,2,2,Semi-Furnished,Ready to Move,Builder,1118,900,14,11,1,-,North-East,Ashiana Tarang,1.  Lift(s)  2.  24/7 Water Supply  3.  24/7 Power Backup  4.  Fire Fighting Systems  5.  InterCom  6.  Car Parking  7.  Gymnasium  8. Club House  9.  Children's Play Area  Project Advantage:  - High speed lifts & latest fire fighting equipments.  - Professional Maintenance.  - 24 Hour Security and gated complex.  - Convenience Store.  - Swimming pool & kids pool.  - Plumber and electrician on call.,1509629247
https://www.olx.in/item/2-bhk-for-sale-in-bhiwadi-ashiana-tarang-iid-1509628261," 32,00,000",Rajasthan,Bhiwadi,Santhalka,Apartments,2,2,Semi-Furnished,Ready to Move,Builder,1118,900,14,14,1,0,North-East,Ashaina Tarang,1.  Lift(s)  2.  24/7 Water Supply  3.  24/7 Power Backup  4.  Fire Fighting Systems  5.  InterCom  6.  Car Parking  7.  Gymnasium  8. Club House  9.  Children's Play Area  Project Advantage:  - High speed lifts & latest fire fighting equipments.  - Professional Maintenance.  - 24 Hour Security and gated complex.  - Convenience Store.  - Swimming pool & kids pool.  - Plumber and electrician on call.,1509628261
https://www.olx.in/item/2bhk-flat-in-reputed-soceity-iid-1517446294," 32,00,000",Rajasthan,Bhiwadi,Khanpur,Builder Floors,2,2,Semi-Furnished,Ready to Move,Owner,1042,1000,3,3,1,1670,West,Konark oasis,Good condition flat,1517446294
https://www.olx.in/item/2bh-avlon-residency-ready-iid-1517388520," 15,90,000",Rajasthan,Bhiwadi,Saidpur,Apartments,2,2,Semi-Furnished,Ready to Move,Owner,850,750,10,2,1,1790,East,Avlon Residency,"Avlon residency  Park Facing, 2bhk with 2 toilets. East facing balcany.wooden work, in kitchin, for sale immidatly...",1517388520
https://www.olx.in/item/all-property-iid-1517275703," 23,00,000",Rajasthan,Bhiwadi,Milakpur Goojar,Apartments,2,1,Unfurnished,Ready to Move,Owner,46,35,3,3,2,300,North-West,Arawali Vihar,"New, Fully Airy and Long Distance to Home City.",1517275703
https://www.olx.in/item/3bh-semi-for-urgent-sale-iid-1517223351," 26,00,000",Rajasthan,Bhiwadi,Saidpur,Apartments,3,3,Semi-Furnished,Ready to Move,Owner,1230,1000,4,0,1,2700,North,Genesis gardenia,Best or lowrise socity available for rent..,1517223351
https://www.olx.in/item/2-bhk-flat-for-sale-iid-1517093009," 31,00,000",Rajasthan,Bhiwadi,Khijooriwas,Apartments,2,2,Unfurnished,Ready to Move,Owner,1234,1050,12,7,1,1100,East,"Nimai greens,bhiwadi",Ready to move in property for sale. Project right on alwar highway.,1517093009
https://www.olx.in/item/2-bhk-semi-furnished-iid-1516948321," 18,00,000",Rajasthan,Bhiwadi,Khijooriwas,Apartments,2,2,Semi-Furnished,Ready to Move,Owner,1111,1000,7,1,1,1800,-,Hill view garden,Club facing   Modular kitchen   Cupboard in both the rooms,1516948321
https://www.olx.in/item/krish-aura-2bhk-with-2-bath-rooms-flat-are-available-for-sale-iid-1516733913," 25,70,000",Rajasthan,Bhiwadi,Saidpur,Apartments,2,2,Semi-Furnished,Ready to Move,Owner,1025,950,14,6,1,2460,East,Krish aura,2bhk flat available for sale out with park facing flat...,1516733913
https://www.olx.in/item/its-very-nice-flat-iid-1516707007," 10,99,000",Rajasthan,Bhiwadi,GFC Colony,Apartments,1,1,Semi-Furnished,Ready to Move,Owner,590,490,9,8,0,1000,East,Omaxe meadow bhiwadi near toll plaza bhiwadi,Studio apartment,1516707007
https://www.olx.in/item/2bhk-ready-to-move-for-sale-iid-1516643502," 25,00,000",Rajasthan,Bhiwadi,Bhiwarl,Apartments,2,2,Semi-Furnished,Ready to Move,Owner,965,760,14,1405,1,2000,North-East,Status Residency,2BHK with full society Amitnities like   * Lift  * Park  * GYM  * Club  * Swimming Pool  * Covered Parking,1516643502
https://www.olx.in/item/proerty-by-owner-iid-1516189199," 25,00,000",Rajasthan,Bhiwadi,Bhiwarl,Apartments,3,2,Semi-Furnished,Ready to Move,Owner,1100,1265,3,0,2,3000,West,Krish Group,"3 bhk with ground floor.  Currently no photo uploaded, for detail send enquiry.",1516189199
https://www.olx.in/item/flat-2-bhk-in-bdi-ambaram-tapukhera-bhiwadi-iid-1516100034," 15,50,000",Rajasthan,Bhiwadi,Milakpur Goojar,Builder Floors,2,1,Semi-Furnished,Ready to Move,Owner,800,650,4,3,-,1610,East,BDI ambaram tapukhera,Flat 2 BHK in bdi ambaram tapukhera  bhiwadi,1516100034
https://www.olx.in/item/3bhk-new-and-unused-flat-for-sell-urgentally-iid-1516055080," 32,00,000",Rajasthan,Bhiwadi,Saidpur,Apartments,3,2,Unfurnished,Ready to Move,Owner,1230,00,14,7,1,2900,West,Keish aura,"3bhk very prime location...  Park facing view,Sun facing balcony.7th floor,,",1516055080
https://www.olx.in/item/very-nice-atmosphere-iid-1515883484," 7,50,000",Haryana,Dharuhera,Ghatal Mahaniawas,Apartments,1,1,Unfurnished,Ready to Move,Owner,475,475,9,4,1,900,South-West,Ashiyana town,Ews flat with nice atmosphere,1515883484
https://www.olx.in/item/rhb-bhiwadi-iid-1515863560," 25,00,000",Rajasthan,Bhiwadi,Nanglia,Houses & Villas,3,2,Unfurnished,Ready to Move,Owner,30,32,3,-,1,-,East,Rhb bhiwadi,Near by central market and industry,1515863560
https://www.olx.in/item/flat-for-sale-in-vanshika-homes-iid-1515716590," 12,67,000",Rajasthan,Bhiwadi,Milakpur Goojar,Apartments,2,2,Unfurnished,Under Construction,Builder,538,527,4,01234,1,000,-,Vanshika homes,Homes project for saleing,1515716590
https://www.olx.in/item/its-big-sosciety-flats-ready-to-move-front-row-main-road-facing-iid-1515535674," 30,00,000",Rajasthan,Bhiwadi,Khijooriwas,Builder Floors,2,2,Semi-Furnished,Ready to Move,Owner,1000,1000,1,2,1,1870,North-East,Essentia bhiwadi,It's new build flats ready to move broker are excuse This spacious Multistorey Apartment is located at 2nd floor in a tower of total 19 floors. The Multistorey Apartment is newly constructed. ''   contact no 9999684240,1515535674
https://www.olx.in/item/2bhk-flat-for-sale-in-aravali-heights-dharuhera-iid-1515487018," 29,00,000",Rajasthan,Bhiwadi,GFC Colony,Apartments,2,2,Unfurnished,Ready to Move,Dealer,1207,1050,13,2,1,2100,West,dwarkadhish aravali heights,"2bhk flat for sale in aravali heights dharuhera , near NH 8  fore more information call.  krishna properties.",1515487018
https://www.olx.in/item/2bhk-in-bdi-sunsine-city-sale-iid-1515252796," 21,90,000",Rajasthan,Bhiwadi,Saidpur,Apartments,2,2,Semi-Furnished,Ready to Move,Owner,1200,1100,10,10,1,2600,East,Bdi sunsine city,2bhk 1200 sq fit  semi firnished flat for sale..,1515252796
https://www.olx.in/item/2bhk-for-urgent-sale-iid-1515249450," 14,95,000",Rajasthan,Bhiwadi,Saidpur,Apartments,2,2,Unfurnished,Ready to Move,Owner,950,800,15,11,1,1800,North-West,Avlon Residency,"2bhk flat for urgent sale...near toll plaza bhiwadi,on highway,near shopping complex,low maint. 100% finance,,  Advet Buildwell  (Property Guide)  Addresh-: S-108,1st flore, krish square, alwar by pass,bhiwadi",1515249450
https://www.olx.in/item/2bhk-at-1850000-iid-1515233475," 18,50,000",Rajasthan,Bhiwadi,Khijooriwas,Apartments,2,2,Semi-Furnished,Ready to Move,Owner,1111,1111,7,7,1,1950,West,Trehan Hill view Garden,2BHK semifurnished at best location in Bhiwadi,1515233475
https://www.olx.in/item/2bhk-flat-in-ready-to-move-condition-iid-1515105849," 22,00,000",Rajasthan,Bhiwadi,Khijooriwas,Apartments,2,2,Unfurnished,Ready to Move,Owner,810,800,17,2,-,-,-,-,The property is in the essentia bhiwadi. Flat is on 2nd floor park facing.,1515105849
https://www.olx.in/item/ready-to-move-2-bhk-flat-on-alwar-byepass-road-iid-1515023391," 18,90,000",Rajasthan,Bhiwadi,Khanpur,Apartments,2,2,Furnished,Ready to Move,Owner,1000,850,-,0,-,-,-,AVALON RANGOLI BHIWADI,FLAT ON ALWAR BYEPASS ROAD NEAR HONDA CARS AND 2 WHEELER PLANT TAPUKARA.  GROUND FLOOR  2 BEDROOMS  2 TOILETS....1 ATTACHED...1 COMMON  AVALON RANGOLI BHIWADI PROJECT.  WALKING DISTANCE FROM HONDA PLANT....  NEW CONSTRUCTION  COMPLETE WOODEN WORK OF KITCHEN AND ALMIRAH IN BEDROOMS.  IRON GRILLS INSTALLED IN WINDOWS FOR BETTER SECURITY.  GATED SOCIETY WITH GUARDS.  SCHOOLS ARE NEARBY.  GREEN AREA IS GOOD.  SHOPS FOR DAILY USABLES IN COMPOUND.  PLAY AREA FOR CHILDREN.  SELLING BECAUSE NEED OF MONEY.  BOUGHT IN 25 LAKH......  ANY BUYER CAN CONTACT ME ..... 8O53I33747,1515023391
https://www.olx.in/item/furnished-maintained-iid-1514908399," 17,00,000",Rajasthan,Bhiwadi,Milakpur Goojar,Apartments,1,1,Furnished,Ready to Move,Owner,725,680,10,10,1,1549,East,Pine appartment cosmod greens,Decorated east facing,1514908399
https://www.olx.in/item/bhiwadi-main-road-apartment-haldiram-sweet-and-two-mall-outside-iid-1514679269," 35,00,000",Rajasthan,Bhiwadi,Santhalka,Apartments,2,2,Semi-Furnished,Ready to Move,Owner,1460,1400,10,5,1,2800,North-East,Kajaria Green,"35 min from Gurgaon, North East Facing, Corner Flat Covered Car Parking Club Membership, Geyser Fan Lights fitted Distance between one flat to another flat 20 fit appox  privacy mentioned ONE STUDY ROOM also Near Daruhera Flyover",1514679269
https://www.olx.in/item/2bhk-for-sale-in-krish-icon-iid-1514550179," 36,00,000",Rajasthan,Bhiwadi,Santhalka,Apartments,2,1,Semi-Furnished,Ready to Move,Owner,820,820,14,10,1,1935,-,Krish Icon,"2BHK for sale in Krish Icon with amenities like pool, car parking, 2 side park facing, wardrobe in each room, fan & wooden work   Call me if needed any further details",1514550179
https://www.olx.in/item/1bhk-flat-for-sale-iid-1514485764," 18,00,000",Rajasthan,Bhiwadi,Milakpur Goojar,Apartments,1,1,Semi-Furnished,Ready to Move,Owner,600,600,4,2,0,1000,North-West,Trehan hill view garden BHiwadi,1BHK flat.,1514485764
https://www.olx.in/item/best-deal-in-flat-iid-1514415971," 21,00,000",Rajasthan,Bhiwadi,Khijooriwas,Apartments,2,1,Semi-Furnished,Ready to Move,Owner,800,850,4,4,1,1800,East,Krish City phase 2,2bhk in Krish City pH. 2 very good location n locality,1514415971
https://www.olx.in/item/i-sell-my-apartment-plz-contact-iid-1514404427," 28,00,000",Rajasthan,Bhiwadi,Bhiwarl,Apartments,2,2,Semi-Furnished,Ready to Move,Owner,930,930,4,1,1,1800,East,Teera city,I  sell my apartment  Teera city alwar express highway bhiwadi,1514404427
https://www.olx.in/item/3-bhk-flat-1st-floor-iid-1514353387," 2,60,00,000",Rajasthan,Bhiwadi,Milakpur Goojar,Apartments,3,2,Semi-Furnished,Ready to Move,Owner,975,975,4,1,2,2500,East,Krish City Phase 2,3 BHK Flat 1st floor  on below of the flat is market.  Nice location to live.  Best deal.,1514353387
https://www.olx.in/item/2-bhk-for-sale-in-ashiana-garden-iid-1514263276," 37,00,000",Rajasthan,Bhiwadi,Khijooriwas,Builder Floors,2,2,Semi-Furnished,Ready to Move,Dealer,1064,1000,2,1,1,2500,West,Ashiana Garden,"It's a two bhk flat,with two bathroom  and two balconies, cross ventilated flat,first floor unit in two floors.",1514263276
https://www.olx.in/item/fully-furnished-12-lakh-only-iid-1514152123," 12,00,000",Rajasthan,Bhiwadi,Khijooriwas,Apartments,1,1,Furnished,Ready to Move,Dealer,650,650,15,10,1,800,North-East,Avalon Residency,Ac double bed sofa set dining table microwave wooden work complete 8000 rupaye rent Aata Hai,1514152123
https://www.olx.in/item/newly-constructed-gated-colony-in-bhiwadii-ready-to-move-in-iid-1514053001," 32,50,000",Rajasthan,Bhiwadi,Bhiwarl,Apartments,3,3,Unfurnished,Ready to Move,Owner,1396,864,-,7,1,-,-,-,"3BHK flat, newly constructed facing pool/garden with 1396sq ft apartment size. The unit boasts of major amenities like gym, club house, banquet hall, swimming pool landscaped garden with children play are. The housing uint is close to shopping malls and educational institutes. The apartment is highly ventilated with 4 balconies.  Ready to move in, directly from the owner, no brokerage fee.",1514053001
https://www.olx.in/item/want-to-sell-my-2-bhk-flat-on-urgent-basis-iid-1513860383," 13,00,000",Rajasthan,Bhiwadi,Khijooriwas,Apartments,2,1,Semi-Furnished,Ready to Move,Owner,650,500,14,5,1,1400,East,Avalon homes,"2 bhk flat with good amenities at Avalon homes,maseet",1513860383
https://www.olx.in/item/1-bhk-ready-to-move-iid-1513837734," 19,50,000",Rajasthan,Bhiwadi,Saidpur,Apartments,1,1,Semi-Furnished,Ready to Move,Owner,750,700,9,1,0,1500,West,Cosmos,Want to sale my 1bhk apartment urgently... Contact urgently only genuine buyers please...,1513837734
https://www.olx.in/item/tizara-road-bhiwadi-iid-1513268518,-,-,-,-,-,-,-,-,-,-,-,-,-,-,-,-,-,-,-,-
https://www.olx.in/item/3bhk-best-lowrise-socity-for-sale--iid-1509118180," 26,75,000",Rajasthan,Bhiwadi,Saidpur,Apartments,3,3,Semi-Furnished,Ready to Move,Owner,1300,1119,5,0,1,2700,West,Genesis gardenia,"3bhk ,ground foor,adjoining genesis mall,  Wooden work completed..  North facing,,,  Bank finance available...Advet Buildwell  (Property Guide)  Addresh-: S-108,1st flore, krish square, alwar by pass, bhiwadi.cont.-01493-493109.",1509118180
https://www.olx.in/item/2-bhk-1025-sqfit-for-sale-near-genesis-mall-big-bazar-iid-1508651509," 25,50,000",Rajasthan,Bhiwadi,Saidpur,Apartments,2,2,Semi-Furnished,Ready to Move,Owner,1025,940,14,6,1,2460,East,Krish aura,"Krish Aura Bhiwadi will give you a colossal experience of living in Bhiwadi. This project is equipped with up-to-date clubhouse & diverse cosy facilities. It is a paradise to live in the lapel into the beauty of nature. The project is going to be best for persons who have smaller and middle earnings. All the luxury suites are going to be totally ventilated and wealthy of Natural Sunlight. These apartments will be more airy than any other apartments or flats in Bhiwadi. This project also gives you the 24 hours power backup facility.. Features - zim ,club,sweeming pools,  Park,new cunstruction.  ....Registration done.... call me 9929926020...Advet Buildwell",1508651509
https://www.olx.in/item/3bhk-for-sale-bdi-sunsine-ready-to-move-iid-1507534462," 26,50,000",Rajasthan,Bhiwadi,Saidpur,Apartments,3,3,Semi-Furnished,Ready to Move,Owner,1490,1280,10,7,0,3450,East,Bdi sunsine city,"3bhk large 1490 sq fit appartment for Sale  urgent ...s3mi furnished..  Big space, 90% occupied socity...",1507534462
https://www.olx.in/item/good-apartments-for-living-iid-1259217179," 16,00,000",Rajasthan,Bhiwadi,Khijooriwas,Apartments,2,2,Semi-Furnished,Ready to Move,Owner,950,950,9,9,1,2000,East,Omaxe Europia,Good apartments for living,1259217179
https://www.olx.in/item/serious-buyers-only-avalon-homes-bhiwadi-iid-1251306381," 5,00,000",Rajasthan,Bhiwadi,Bhiwarl,Apartments,1,1,Unfurnished,Ready to Move,Owner,550,460,14,-,-,1000,-,-,Serious buyers only. Avalon Homes Bhiwadi. 5km from Honda chowk towards Alwar,1251306381
https://www.olx.in/item/1-bhk-cosmos-society-iid-1502426212," 17,00,000",Rajasthan,Bhiwadi,Saidpur,Apartments,1,1,Semi-Furnished,Ready to Move,Owner,725,550,10,01,0,1500,East,Cosmos green,1st floor flat,1502426212
https://www.olx.in/item/flat-is-just-sale-1-bhk-urgent-sell-mob8104640792-iid-1245742907," 6,99,999",Rajasthan,Bhiwadi,Khijooriwas,Builder Floors,1,1,Unfurnished,Ready to Move,Owner,473,305,10,1,1,890,North,Ashiana,Urgent sell mob.81046407.9.2 flat location.bhiwadi to tapukara road toll tax se 1.5 km.next right side ko trehan society ke samne ashiana town me frist floor pe,1245742907
https://www.olx.in/item/hello-frendz-i-am-sale-my-villa-plot-from-omaxe-panorma-iid-1206119833," 32,00,000",Rajasthan,Bhiwadi,Alupur,Houses & Villas,4,1,Unfurnished,Under Construction,Owner,215,215,-,-,3,1000,-,Omax,Hello frendz i am sale my Villa from Omaxe City 2 Bhiwadi 215 Gajj,1206119833
https://www.olx.in/item/5-bhk-individual-villa-for-sale-iid-1188837309," 50,40,000",Rajasthan,Bhiwadi,Milakpur Goojar,Houses & Villas,4,4+,Furnished,Ready to Move,Owner,2000,2000,2,-,1,-,North,-,"5 BHK, individual Villa for sale. Ground floor - 2 BHK & 1st floor 3 BHK. Both side open corner plot. 5 latrine & bath room, 3 Kitchen. Total drawing room - 3 & bed room -5",1188837309
https://www.olx.in/item/brand-new-2-bhk-flat-with-covered-parking-iid-1121521995," 17,00,000",Rajasthan,Bhiwadi,Alupur,Apartments,2,2,Furnished,Ready to Move,Owner,965,965,14,10,1,-,-,THD Garden,Brand new 2 bhk flat with covered parking available near industrial hub in a well developed Trehan's THD Gardens society. This is located at Alwar byepass road behind old Trehan's society. All internal lights & fans are installed. Gas pipeline is already done. Well suitable for family and professionals. Only serious buyers can call.,1121521995
https://www.olx.in/item/ready-to-move-in-alwar-by-pass-road-bhiwadi-iid-1517985730," 16,99,000",Rajasthan,Bhiwadi,Khanpur,Builder Floors,2,2,Unfurnished,Ready to Move,Dealer,580,680,2,2,1,1100,North-East,Trehan independent floor,Ready to move property prime location in bhiwadi affordable price,1517985730
https://www.olx.in/item/4-bhk-flat-for-sale-in-dharuhera-iid-1516548595," 36,00,000",Haryana,Dharuhera,Sai Niwas,Houses & Villas,4,3,Furnished,Ready to Move,Owner,1500,1400,3,1,2,-,-,Parsavnath Devloper,4 bhk flat  in Dharuhera,1516548595
https://www.olx.in/item/new-home-in-dharuhera-iid-1515971035," 39,50,000",Haryana,Dharuhera,Alwal Pur,Farm Houses,4+,2,Semi-Furnished,Ready to Move,Owner,2700,2300,3,-,-,-,East,-,1.main Khuskhera road from 30 meter   2.three schools under 500meters distance  2 hospital under 1 kilometres  Risneble price,1515971035
https://www.olx.in/item/2-bhk-flat-avalon-rangoli-iid-1515407537," 28,00,000",Haryana,Dharuhera,Dharuhera,Apartments,2,2,Semi-Furnished,New Launch,Owner,1300,1300,12,8,1,-,-,"Avalon Rangoli, Dharuhera","2 BHK Flat, 1300 Sqf area, 24 hours Electric backup, Lift, Garden, 24 hour security, on call maintenance services, GYM, Swimming Pool, Club facilities.",1515407537
https://www.olx.in/item/this-is-2bhk-flat-very-well-maintainsun-and-park-facing-iid-1515398128," 15,50,000",Rajasthan,RIICO Industrial Area Chopanki,Tapukadi,Apartments,2,2,Furnished,Ready to Move,Owner,790,550,4,2,1,2000,-,Krishcity-ll,I need urgent some mony,1515398128
https://www.olx.in/item/2bhk-corner-flat-at-best-location-5th-floor-for-sale-bhiwadi-iid-1514592899," 34,50,000",Rajasthan,Bhiwadi,Khanpur,Apartments,2,2,Semi-Furnished,Ready to Move,Owner,1165,900,14,5,0,2600,North-East,Ashiana Town,All wood work done and best construction by brand Ashiana,1514592899
https://www.olx.in/item/uit-aproved-light-water-connection-opposite-kalla-petrol-pump-iid-1517867262," 23,00,000",Rajasthan,Bikaner,MDV Nagar,Houses & Villas,2,1,Semi-Furnished,New Launch,Owner,400,400,1,1,2,0,East,Bangla nagar,For new house  Contact 9530018191,1517867262
https://www.olx.in/item/3-bhk-house-2549-at-sudarsana-nagarbikaner-iid-1287827261," 65,00,000",Rajasthan,Bikaner,Sudarshana Nagar,Houses & Villas,3,2,Semi-Furnished,Ready to Move,Dealer,1250,1250,1,-,-,-,North,-,"Prime location 3 bhk house available at Sudarsana Nagar colony,Bikaner.   Size-25*49.  Facing-North.  Room-3-(including drawing room).   Lathbath-2.( western).  Kitchen-1.  1 dinning hall.  Open lobby in front.  Price-65 lacs  Brokerage-2% of final deal amount(non negotiable & non refundable.)  Patta-U.I.T.  Clear title.  Direct buyers call,brokers don't call.  Call timing-10 am-8 pm only.  For further queries call-   Rajwadi Properties-  Abhayy Singh.  838797584 Six",1287827261
https://www.olx.in/item/5080-constructed-building-at-sadulganj-colony-iid-1503775642," 51,00,00,000",Rajasthan,Bikaner,Bikaneri,Houses & Villas,4+,4+,Semi-Furnished,Ready to Move,Dealer,13000,13000,4,4,2,0,West,-,"Prime location building.  Sadulganj colony,50 metres from main road,near panchwati circle.  Construction age-10 years.  Construction area-13000 sq/ft.  4 floor building.  Area-50*80  Expected Rental income-4 lac-5lac.  Best for hospital, clinic,company office etc..  Uit patta.  Facing-west.  Rate-5.1 cr.  Brokerage-1% of final deal amount.  For details call   Abhayy Singh-  856106074six",1503775642
https://www.olx.in/item/prime-location-4-bhk-available-at-pawanpuri-colonybikaner-iid-1503839686," 1,50,00,000",Rajasthan,Bikaner,Pawanpuri Colony,Houses & Villas,4,2,Unfurnished,Ready to Move,Dealer,3080,3080,1,0,1,0,North,-,"Prime Location 4 bhk house.  Location-Pawanpuri.Near Bikaner nursing home,50 metres from main road.  Size-44*70.  4 bhk house  Room-4,  hall-1,  kitchen-1,  lathbath-2  ,car parking.  Size-3080 sq/ft.  Facing-North.  Price-1.5Cr.(negotiable).  Uit patta.  Brokerage-2% of final deal.  Best for Doctors & business class people.  For details call-  Abhayy Singh-  856106074six.",1503839686
https://www.olx.in/item/3-bhk-house-3064-at-bajrang-viharbikaner-iid-1503829851," 50,00,000",Rajasthan,Bikaner,Bikaneri,Houses & Villas,3,2,Unfurnished,Ready to Move,Dealer,1950,1950,1,0,1,0,South,-,"Prime location 3 bhk  house available at bajrang vihar colony,near sai baba mandir,,Bikaner.   Size-30*65  Facing-south.  Room-3  Lathbath-2  Kitchen-1  1 mandir space.  dinning hall.  Balcony.  Open Terrace.  Open lobby in front.  Freehold patta.  Price-50 lacs  Brokerage-2% of final deal amount(non negotiable & non refundable.)  Clear title.  Direct buyers call,brokers don't call.  Call timing-10 am-8 pm only.  For further queries call-   Abhayy Singh.  838797584 Six",1503829851
https://www.olx.in/item/6-bhk-house-at-rani-bazar-available-iid-1515849971," 1,50,00,000",Rajasthan,Bikaner,Rani Bazar,Houses & Villas,4+,4,Semi-Furnished,Ready to Move,Dealer,3200,1600,1,0,0,0,West,-,"6 bhk duplex house.  Location-Rani bazar colony,Bikaner.   Size-20*80 or 400 gaj.+godown-15*30(extra).  Facing-west.  Room-6-(1st & 2nd floor).(with wardrobes)  Lathbath-4( both floors).(  Kitchen-2.(Modular work).  1 mandir space.  2 dinning hall.  Balcony-2.  1 basement-15*70.  Open lobby in front.  Patta gangasahi.  Price-1.5cr.  Brokerage-1% of final deal amount(non negotiable & non refundable.)  Clear title.  Direct buyers call,brokers don't call.  Call timing-10 am-8 pm only.  For further queries call-   Rajwadi Properties-  Abhayy Singh.",1515849971
https://www.olx.in/item/prime-location-east-facing-2545-house-at-jnv-colonybikaner-iid-1515848562," 68,00,000",Rajasthan,Bikaner,JNV Colony,Houses & Villas,4+,3,Unfurnished,Ready to Move,Dealer,1125,1125,1,0,0,0,East,-,"25*45 house at prime location Jnv colony,  5 Bhk duplex house( old construction) at Jnv colony(near murti circle,Bikaner.)  Facing-east.   Room-5-(2 floors).  Lathbath-2 (western.)   Kitchen-2  2 dinning hall.   Fan And  light fitted.   Open lobby.  Main market near by.   Park nearby.  Uit patta.  Price-68 lacs.  Brokerage-2% of final deal amount(non negotiable & non refundable amount).  Direct buyers call.  For further queries call-   Abhayy Singh.",1515848562
https://www.olx.in/item/prime-location-3-bhk-house-4670-at-pawanpuribikaner-iid-1515843781," 1,50,00,000",Rajasthan,Bikaner,Pawanpuri Colony,Houses & Villas,3,2,Semi-Furnished,Ready to Move,Dealer,3220,3220,0,0,2,0,East,-,"Prime Location   3 Bhk semi Furnished house.  Location-Pawanpuru,near Bikaner nursing home.  Facing-east.  Room-3 with wooden wardrobes.  Lathbath-2 (western.)   Kitchen-Modular kitchen.  1 big dinning hall.  Garden area.  Fan And led light fitted  Washing area.  Car Parking available.   Main market near by.  Rate-1.5 cr.  Uit patta  Brokerage-2% of final deal amount.(non negotiable & non refundable amount).  Rent agreement charges extra.  Best for doctors,businessman etc.  For further queries call-   Abhayy Singh",1515843781
https://www.olx.in/item/i-am-selling-my-house-on-tha-rat-of-3000000-iid-1517740452," 30,00,000",Rajasthan,Bikaner,MP Nagar,Houses & Villas,4+,2,Furnished,New Launch,Owner,2000,1700,2,1,1,-,East,House sale,I am selling my house situated on muktaprsad 11 nambar sectar,1517740452
https://www.olx.in/item/3-bhk-flat-at-pawanpuri-in-ready-to-move-condition-iid-1515763639," 51,00,000",Rajasthan,Bikaner,Pawanpuri Colony,Apartments,3,3,Semi-Furnished,Ready to Move,Dealer,2000,1700,9,4,1,0,West,-,Prime Location 3 Bhk Flat Available at Pawanpuri.Bikaner.   4th Floor.   Room-3 with wooden wardrobes and attach lathbath.  Lathbath-3 (western.)   (2 attach lathbath in room+1 in hall with vetrified tiles.)  Kitchen-Modular kitchen.   1 big dinning hall.   Fan And led light fitted.   Balcony-3.  Car Parking available.   Main market near by.   Lift+ guards available 24*7.  Rate-51 lacs only.  Brokerage-2% of final deal amount.(non negotiable & non refundable amount).  For further queries call-   Abhayy Singh  838797584six,1515763639
https://www.olx.in/item/house-for-sell--iid-1517699195," 35,00,000",Rajasthan,Bikaner,Vallabh Gardan,Houses & Villas,3,3,Unfurnished,Ready to Move,Owner,1029,1029,2,0,1,2000,North,"House for sell , contact:- 9829997103",House for sell,1517699195
